{
  "$schema": "http://json-schema.org/draft-07/schema#",
  "$ref": "#/definitions/SalesChannel",
  "definitions": {
    "SalesChannel": {
      "type": "object",
      "example": {
        "name": "et",
        "salesChannelNumber": "Ut minim",
        "id": "non ut nulla Excepteur anim",
        "description": "exercitation aliquip in",
        "externalRecord": "proident consectetur nulla et in",
        "salesChannelType": [
          "culpa incididunt exercitation Lorem",
          {
            "id": "id",
            "name": "in Excepteur"
          }
        ],
        "auditInfo": {
          "isDeleted": true,
          "createdBy": "magna dolore",
          "updatedBy": "pariatur enim",
          "updatedDate": null,
          "createdDate": null
        }
      },
      "additionalProperties": true,
      "required": [
        "name",
        "salesChannelNumber",
        "id",
        "description"
      ],
      "properties": {
        "id": {
          "anyOf": [
            {
              "type": "string"
            },
            {
              "type": "null"
            }
          ]
        },
        "name": {
          "type": "string"
        },
        "externalRecord": {
          "type": "string"
        },
        "salesChannelType": {
          "type": "array",
          "items": {
            "anyOf": [
              {
                "type": "string"
              },
              {
                "type": "object",
                "additionalProperties": true,
                "required": [
                  "id",
                  "name"
                ],
                "properties": {
                  "id": {
                    "anyOf": [
                      {
                        "type": "string"
                      },
                      {
                        "type": "null"
                      }
                    ]
                  },
                  "name": {
                    "type": "string"
                  },
                  "auditInfo": {
                    "description": "Defines standard system audit fields available for most types",
                    "type": "object",
                    "example": {
                      "isDeleted": true,
                      "createdBy": "commodo minim dolore est",
                      "updatedBy": "dolor quis nulla",
                      "updatedDate": "1950-01-23T19:52:29.659Z",
                      "createdDate": "1950-01-23T19:52:29.659Z"
                    },
                    "additionalProperties": true,
                    "required": [
                      "isDeleted",
                      "createdBy",
                      "updatedBy",
                      "updatedDate",
                      "createdDate"
                    ],
                    "properties": {
                      "createdDate": {
                        "anyOf": [
                          {
                            "type": "string",
                            "format": "date-time"
                          },
                          {
                            "type": "null"
                          }
                        ],
                        "description": "Timestamp of when the entity was created"
                      },
                      "createdBy": {
                        "type": "string",
                        "description": "Identifies the system or user which created the entity"
                      },
                      "updatedDate": {
                        "anyOf": [
                          {
                            "type": "string",
                            "format": "date-time"
                          },
                          {
                            "type": "null"
                          }
                        ],
                        "description": "Timestamp of when the entity was last updated"
                      },
                      "updatedBy": {
                        "type": "string",
                        "description": "Identifies the system or user which last updated the entity"
                      },
                      "isDeleted": {
                        "anyOf": [
                          {
                            "type": "boolean"
                          },
                          {
                            "type": "null"
                          }
                        ],
                        "description": "Indicates whether or not the entity has been soft-deleted"
                      }
                    }
                  }
                }
              }
            ]
          }
        },
        "description": {
          "type": "string"
        },
        "salesChannelNumber": {
          "type": "string"
        },
        "auditInfo": {
          "description": "Defines standard system audit fields available for most types",
          "type": "object",
          "example": {
            "isDeleted": true,
            "createdBy": "commodo minim dolore est",
            "updatedBy": "dolor quis nulla",
            "updatedDate": "1950-01-23T19:52:29.659Z",
            "createdDate": "1950-01-23T19:52:29.659Z"
          },
          "additionalProperties": true,
          "required": [
            "isDeleted",
            "createdBy",
            "updatedBy",
            "updatedDate",
            "createdDate"
          ],
          "properties": {
            "createdDate": {
              "anyOf": [
                {
                  "type": "string",
                  "format": "date-time"
                },
                {
                  "type": "null"
                }
              ],
              "description": "Timestamp of when the entity was created"
            },
            "createdBy": {
              "type": "string",
              "description": "Identifies the system or user which created the entity"
            },
            "updatedDate": {
              "anyOf": [
                {
                  "type": "string",
                  "format": "date-time"
                },
                {
                  "type": "null"
                }
              ],
              "description": "Timestamp of when the entity was last updated"
            },
            "updatedBy": {
              "type": "string",
              "description": "Identifies the system or user which last updated the entity"
            },
            "isDeleted": {
              "anyOf": [
                {
                  "type": "boolean"
                },
                {
                  "type": "null"
                }
              ],
              "description": "Indicates whether or not the entity has been soft-deleted"
            }
          }
        }
      }
    }
  }
}