{
  "name": "in proident dolor",
  "salesChannelNumber": "nulla",
  "id": "commodo ullamco",
  "description": "adipisicing ipsum qui",
  "externalRecord": "sunt labore",
  "salesChannelType": [
    "laborum non ex esse et"
  ],
  "auditInfo": {
    "isDeleted": null,
    "createdBy": "qui cillum sunt",
    "updatedBy": "nisi",
    "updatedDate": "1987-11-24T21:40:14.393Z",
    "createdDate": "2007-09-22T02:13:15.075Z"
  }
}
